"updatedAt","title","summaryPreview","link","pubDate"
"2026-07-01T04:23:22.595Z","알바몬, '안심 채용' 경험 확산 나선다…1.5만개 경품 내건 참여형 프로...","▲아이폰 17 Pro(256GB) ▲현금 77만 원 ▲휴먼메이드 백팩 등 트렌디한 상품과 더불어 교촌치킨, 올리브영, 배스킨라빈스, 네이버페이 등 실생활에서 활용도 높은 기프티콘이...","https://www.thefairnews.co.kr/news/articleView.html?idxno=80978","Wed, 01 Jul 2026 13:06:00 +0900"
"2026-07-01T04:23:22.595Z","“월드컵 특수 벌써 끝”... 한국 32강 진출 실패에 난감해진 유통업계","BBQ와 bhc, 교촌치킨 등은 오전 경기 시간대에도 매장을 조기 개점하거나 배달 프로모션을 진행하며 집과 사무실에서 경기를 관람하는 수요를 끌어들였다. 대형마트와 편의점에서도 맥...","https://vop.co.kr/A00001695586.html","Wed, 01 Jul 2026 12:02:00 +0900"
"2026-07-01T04:23:22.595Z","알바몬, 여름 브랜드 캠페인 ‘알바는 원래 알바몬’ 참여형 프로모션 ...","이 밖에 교촌치킨, 올리브영, 배스킨라빈스, 네이버페이 등 다양한 모바일 경품을 제공한다. 한편 알바몬은 여름 브랜드 캠페인 ‘알바는 원래 알바몬’을 전개하며 여름 안심 알바 채용...","https://www.socialvalue.kr/news/view/1065578062904358","Wed, 01 Jul 2026 10:56:00 +0900"
"2026-07-01T04:23:22.595Z","대학생 손편지에 담긴 감사… 보훈가족 찾아간 따뜻한 발걸음","이와 함께 교촌치킨의 후원 물품도 함께 전달됐다. 대한적십자사 RCY는 '사랑과 봉사'의 적십자 정신을 바탕으로 활동하는 대학생 봉사단체로, 지역사회 곳곳에서 다양한 나눔 활동을...","https://n.news.naver.com/mnews/article/277/0005783933?sid=102","Wed, 01 Jul 2026 10:33:00 +0900"
"2026-07-01T04:23:22.595Z","“버거만 잘하는 줄 알았는데?”…대학생이 꼽은 치킨 3위의 반전","이어 굽네치킨 22%, 교촌치킨 20.2% 순이었다. 맘스터치는 버거뿐 아니라 치킨 부문에서도 대학생 선호도가 높게 나타났다는 점에 의미를 두고 있다. 다만 이번 조사는 브랜드별...","https://n.news.naver.com/mnews/article/022/0004139597?sid=101","Wed, 01 Jul 2026 10:30:00 +0900"
"2026-07-01T04:23:22.595Z","[HR 뉴스브리핑] 알바몬, '알바는 원래 알바몬' 캠페인 참여형 프로모션...","이 밖에 교촌치킨, 올리브영, 배스킨라빈스, 네이버페이 등 다양한 모바일 경품을 제공한다. 원티드랩, 한국관광공사와 '관광데이터 AI 프롬프톤' 성료 원티드랩은 한국관광공사와 공동...","https://www.asiatime.co.kr/article/20260701500066","Wed, 01 Jul 2026 10:00:00 +0900"
"2026-07-01T04:23:22.595Z","[#IT라운지] QAI-클래시크 '파트너십'·카카오 '연구 지원'·여기어때 '할...","경품은 아이폰 17프로 오렌지, 현금 77만 원, 휴먼메이드 백팩 등 총 1만5000여개 규모로 마련됐으며 교촌치킨·올리브영·배스킨라빈스·네이버페이 등 모바일 경품도 포함됐다. ◆...","https://www.newsworks.co.kr/news/articleView.html?idxno=845656","Wed, 01 Jul 2026 09:48:00 +0900"
"2026-07-01T04:23:22.595Z","알바몬, '알바는 원래 알바몬' 캠페인 참여형 프로모션 ""안심 공고 지원...","이 밖에 교촌치킨, 올리브영, 배스킨라빈스, 네이버페이 등 다양한 모바일 경품을 제공한다. 김지원 웍스피어 최고성장책임자(CGO)는 ""이번 프로모션은 브랜드 캠페인으로 전한 알바몬...","https://edu.donga.com/news/articleView.html?idxno=109466","Wed, 01 Jul 2026 09:28:00 +0900"
"2026-07-01T04:23:22.595Z","바삭한 유혹, ‘K-치킨벨트’를 따라 떠나는 미식 여행 [여행+]","교촌·멕시카나·펠리카나 등 유명 치킨 프랜차이즈 상당수가 대구·경북 지역에서 출발한 것으로 알려져 있다. 여름마다 열리는 ‘대구 치맥 페스티벌’은 2013년 시작 이래 누적 관람객...","https://n.news.naver.com/mnews/article/022/0004139549?sid=103","Wed, 01 Jul 2026 07:16:00 +0900"
"2026-07-01T04:23:22.595Z","낙전수입 기다리나?...카페 선불카드 '발행일' 표기안해 기간 경과하면...","사진=독자 제공 1일 업계에 따르면 스타벅스와 이디야커피, 투썸플레이스, 할리스, 커피빈 등 주요 카페 프랜차이즈와 교촌치킨, BHC, bbq 등 치킨 브랜드 등 대다수 업체가 발...","http://www.consumernews.co.kr/news/articleView.html?idxno=758179","Wed, 01 Jul 2026 06:20:00 +0900"
